index,Unnamed: 0,source,author,title,description,url,urlToImage,publishedAt,content,row_id,sentiment_type,sentiment_score
0,id,bbc-news,https://www.facebook.com/bbcnews,Turkey earthquake: Before and after images show extent of destruction,Photos from Turkey and Syria show collapsed buildings and devastation across the region.,https://www.bbc.co.uk/news/world-europe-64544998,https://ichef.bbci.co.uk/news/1024/branded_news/A04A/production/_128543014_before_after_promo.png,2023-02-06T17:56:32Z,"Two huge earthquakes and a series of aftershocks have hit Turkey, Syria and the surrounding region, killing more than 2,300 people and causing widespread destruction.
The first quake, of 7.8 magnitu… [+1393 chars]",0,compound,-0.7783
1,id,bbc-news,,Turkey earthquake demolishes buildings in Malatya - video,"A 7.8 magnitude earthquake struck south-eastern Turkey, demolishing buildings in Malatya and trapping people.",https://www.bbc.co.uk/news/av/world-middle-east-64534050,https://ichef.bbci.co.uk/news/1024/branded_news/1700F/production/_128532249_turky.png,2023-02-06T04:30:57Z,"A 7.8 magnitude earthquake struck south-eastern Turkey, demolishing buildings in Malatya and trapping people.
Turkish officials report more than 50 people killed, and the toll is rising as a wide ar… [+73 chars]",1,compound,-0.7759
2,id,bbc-news,https://www.facebook.com/bbcnews,Turkey quake: Heavy rain hampers rescue efforts,"At least 3,500 people are confirmed dead in the quake that struck northern Syria and Turkey.",https://www.bbc.co.uk/news/world-europe-64548985,https://ichef.bbci.co.uk/news/1024/branded_news/E776/production/_128545295_gettyimages-1246852841.jpg,2023-02-07T01:30:11Z,"Media caption, Turkey and Syria earthquake: Drone footage shows Turkey earthquake aftermath
Rescuers are battling heavy rain and snow as they race against the clock to find survivors of a devastatin… [+4196 chars]",2,compound,-0.2732
3,id,bbc-news,,Turkey earthquake: Dramatic moments from first quake on video,Verified footage on social media from the moments the earthquake struck Turkey and Syria on Sunday morning.,https://www.bbc.co.uk/news/av/64544624,https://ichef.bbci.co.uk/news/1024/branded_news/126F0/production/_128540557_p0f1c9ky.jpg,2023-02-06T15:16:41Z,"Aerials of totally destroyed buildings in Idlib, Syria. Video, 00:00:34Aerials of totally destroyed buildings in Idlib, Syria",3,compound,-0.7897
4,id,bbc-news,https://www.facebook.com/bbcnews,Finland calls for 'time-out' in heated Nato talks with Turkey,"Finland has pledged to join Nato with Sweden, but issues with member Turkey are hampering its efforts.",https://www.bbc.co.uk/news/world-europe-64261617,https://ichef.bbci.co.uk/news/1024/branded_news/18D7/production/_128395360_66bf54892a84cb54b44a4431715b1405f96c23ed.jpg,2023-01-24T11:38:55Z,"A ""time-out"" is needed in Finland and Sweden's talks with Turkey about joining Nato, Helsinki's Foreign Minister Pekka Haavisto has said.
A series of controversial protests in Sweden, including the … [+2124 chars]",4,compound,-0.4019
5,id,bbc-news,,Turkey earthquake: Drone flies over Hatay revealing extent of destruction,New vision shows the extent of the earthquake damage across the city in southern Turkey.,https://www.bbc.co.uk/news/av/world-europe-64564357,https://ichef.bbci.co.uk/news/1024/branded_news/1079D/production/_128558476_p0f1pr97.jpg,2023-02-08T02:22:37Z,"BBC reports from Antakya, a city reduced to rubble. Video, 00:00:53BBC reports from Antakya, a city reduced to rubble",5,compound,0.0
6,id,bbc-news,,Turkey earthquake: Girl rescued from destroyed building in Hatay province,A girl is rescued by firefighters from the ruins of a building in Turkey's Hatay province.,https://www.bbc.co.uk/news/av/world-europe-64556225,https://ichef.bbci.co.uk/news/1024/branded_news/5C99/production/_128550732_p0f1k1xq.jpg,2023-02-07T11:59:06Z,"Rescuers are racing to save people trapped beneath the rubble after thousands of buildings collapsed in the earthquake in Turkey and Syria. 
This girl was rescued by firefighters, from the ruins of … [+28 chars]",6,compound,-0.34
7,id,bbc-news,https://www.facebook.com/bbcnews,Turkey and Syria earthquake: Bodies found in search for volleyball team,A school group of 39 people were in a hotel in southern Turkey when the building collapsed.,https://www.bbc.co.uk/news/world-europe-64579269,https://ichef.bbci.co.uk/news/1024/branded_news/2799/production/_128573101_84681410-a7c6-11ed-a78d-79f011f7ba06.jpg,2023-02-09T11:11:39Z,"Three bodies have been found as rescuers in Turkey search a collapsed hotel for a group of school volleyball players following Monday's earthquakes. 
The bodies of two teachers and a student were re… [+2235 chars]",7,compound,-0.2732
8,id,bbc-news,https://www.facebook.com/bbcnews,Turkey earthquake: Erdogan 'responsible for this' opposition leader says,Many are accusing the Turkish government of being underprepared ahead of Monday's huge quakes.,https://www.bbc.co.uk/news/world-europe-64566296,https://ichef.bbci.co.uk/news/1024/branded_news/1481B/production/_128559938_mediaitem128559937.jpg,2023-02-08T10:40:56Z,"Anger is growing in Turkey over the government's perceived failure to prepare after thousands died in two huge earthquakes on Monday.
The death toll in Turkey has risen to 6,957, according to the co… [+4267 chars]",8,compound,-0.91
9,id,bbc-news,https://www.facebook.com/bbcnews,Swedish flag burnt in Jakarta amid Turkey Nato row,"Indonesia is the latest country to see anti-Sweden protests, after a Quran burning in Stockholm.",https://www.bbc.co.uk/news/world-asia-64457233,https://ichef.bbci.co.uk/news/1024/branded_news/13A98/production/_128463508_03c1425b71ac745a35121652f22b28fb8e60b6321280_1275_4051_22794051x2279.jpg,2023-01-30T18:55:06Z,"Protesters gathered outside Sweden's embassy in Jakarta, Indonesia, on Monday to demonstrate against the burning of a Quran by a far-right Danish politician.
Rasmus Paludan destroyed the Muslim holy… [+2306 chars]",9,compound,-0.6249
10,id,bbc-news,,Turkey earthquake: Children rescued from rubble in Syria,Teams pull two children to safety from the rubble in separate rescues in Aleppo and Idlib.,https://www.bbc.co.uk/news/av/world-middle-east-64554755,https://ichef.bbci.co.uk/news/1024/branded_news/17C7D/production/_128550479_p0f1k0fz.jpg,2023-02-07T11:54:27Z,"Aerials of totally destroyed buildings in Idlib, Syria. Video, 00:00:34Aerials of totally destroyed buildings in Idlib, Syria",10,compound,-0.7897
11,id,bbc-news,https://www.facebook.com/bbcnews,Turkey earthquake: How do search and rescue teams save people?,"A search and rescue operation is under way, with specialist teams arriving from around the world.",https://www.bbc.co.uk/news/world-64569943,https://ichef.bbci.co.uk/news/1024/branded_news/16E00/production/_128569639_gettyimages-1246870394.jpg,2023-02-08T18:06:26Z,"Thousands of people have been killed after a massive earthquake struck Turkey and Syria on Monday. 
A search and rescue operation is under way, with specialist teams arriving from around the world. … [+3974 chars]",11,compound,-0.4939
12,id,bbc-news,https://www.facebook.com/bbcnews,Turkey earthquake: Roman-era castle destroyed by quake,"Footage showed widespread devastation at the 2,000-year-old Gaziantep Castle.",https://www.bbc.co.uk/news/world-europe-64541894,https://ichef.bbci.co.uk/news/1024/branded_news/AF5D/production/_128539844_gettyimages-1246837196.jpg,2023-02-06T15:18:19Z,"The devastation wrought by Monday's deadly earthquake in south-eastern Turkey included the almost total destruction of a 2,000-year-old castle built during the Roman Empire. 
Footage obtained by the… [+1679 chars]",12,compound,-0.7369
13,id,bbc-news,https://www.facebook.com/bbcnews,Turkey and Syria earthquake: ‘It was like a doomsday scenario',Ismael had just left his son in hospital when the building started to collapse.,https://www.bbc.co.uk/news/world-middle-east-64538295,https://ichef.bbci.co.uk/news/1024/branded_news/A0B8/production/_128544114_mediaitem128544113.jpg,2023-02-07T10:30:41Z,"When the earthquake struck in the middle of the night, it was an especially terrifying moment for Ismael Alraj.
He had just stepped outside the hospital in al-Dana, in north-western Syria, where had… [+6415 chars]",13,compound,-0.7178
14,id,bbc-news,https://www.facebook.com/bbcnews,Turkey and Syria earthquake: ‘The worst thing is to be a doctor in these circumstances’,Ahmed al-Masri describes the horror he felt while treating Syrian children injured in the earthquake.,https://www.bbc.co.uk/news/world-middle-east-64574606,https://ichef.bbci.co.uk/news/1024/branded_news/1CE4/production/_128569370_mediaitem128569369.jpg,2023-02-09T00:06:26Z,"""The look in this child's eyes really got to me,"" says Dr Ahmed al-Masri. ""I don't know why but as soon as he looked at me, I started crying.""
It was more than 30 hours after Monday's devastating ea… [+4240 chars]",14,compound,-0.9022
15,id,bbc-news,,Turkey earthquake: Gaziantep residents run for cover when another building collapses,Video shows residents assessing quake damage when another building gives way.,https://www.bbc.co.uk/news/av/world-europe-64549747,https://ichef.bbci.co.uk/news/1024/branded_news/16606/production/_128545619_p0f1gq46.jpg,2023-02-07T03:30:42Z,"Social media footage shows a building collapse in Gaziantep, Turkey following Mondays deadly earthquake. Residents were assessing damage in the area when the building suddenly gave way. 
The 7.8 mag… [+118 chars]",15,compound,-0.7506
16,id,bbc-news,https://www.facebook.com/bbcnews,Turkey earthquake rescue: How two sisters were saved from the rubble,The BBC witnesses the hours-long rescue of Merve and Irem from a collapsed apartment block in Turkey.,https://www.bbc.co.uk/news/world-middle-east-64612317,https://ichef.bbci.co.uk/news/1024/branded_news/1FCC/production/_128604180_rescue2.jpg,2023-02-11T18:55:57Z,"Media caption, Watch: Rescuers use specialist cameras to free Irem And Merve from the rubble of their building in Antakya
""Merve! Irem! Merve! Irem,"" rescue worker Mustafa Ozturk is shouting. Everyo… [+6188 chars]",16,compound,0.765
17,id,bbc-news,https://www.facebook.com/bbcnews,Turkey elections: Biggest test for Erdogan amid cost of living crisis,Rampant inflation is a key issue for voters as Turkey’s President Erdogan faces elections in May.,https://www.bbc.co.uk/news/world-europe-64413620,https://ichef.bbci.co.uk/news/1024/branded_news/13BD4/production/_128525808_gettyimages-1246323638.jpg,2023-02-05T01:31:49Z,"""I was paying 4,500 liras ($240; £195) for rent last year, but my landlord said he needed to raise the price,"" said Seda. ""We doubled the amount we pay, but he still asked us to leave the flat.""
She… [+5152 chars]",17,compound,-0.2263
18,id,bbc-news,https://www.facebook.com/bbcnews,Turkey-Syria earthquake: Survivor in rubble sparks hope for more 'miracles',"Days after Turkey's devastating earthquake, there are still some moments of joy, but they are fewer.",https://www.bbc.co.uk/news/world-europe-64570463,https://ichef.bbci.co.uk/news/1024/branded_news/124F4/production/_128569947_rescue1.jpg,2023-02-08T21:21:59Z,"Media caption, Watch: Onlookers wait in silence - before a woman is carried alive from the rubble days after earthquake
Rescue workers called for silence at a fallen apartment building in the southe… [+2575 chars]",18,compound,0.5267
19,id,bbc-news,https://www.facebook.com/bbcnews,Turkey earthquake: One ruined neighbourhood at the centre of the devastation,Thousands are sheltering in makeshift camps like the one set up in heart of this neighbourhood reduced to rubble by Monday's earthquakes.,https://www.bbc.co.uk/news/world-europe-64581229,https://ichef.bbci.co.uk/news/1024/branded_news/FE21/production/_128575056_gettyimages-1246861133.jpg,2023-02-09T11:27:55Z,"Monday's double earthquake in Turkey and Syria caused devastation across the region, killing thousands and destroying buildings and neighbourhoods in dozens on cities.
In Kahramanmaras, which was ne… [+2346 chars]",19,compound,-0.8957
20,id,bbc-news,,Baby among those rescued days after quake,Families in some badly-hit areas complain they have had no help digging to find relatives.,https://www.bbc.co.uk/news/av/world-europe-64573926,https://ichef.bbci.co.uk/news/1024/branded_news/D224/production/_128569735_baby.jpg,2023-02-08T19:03:48Z,"Up Next. Turkey survivors: 'It never gets warm, we are freezing' Video, 00:00:52Turkey survivors: 'It never gets warm, we are freezing'",20,compound,-0.4822
21,id,bbc-news,https://www.facebook.com/bbcnews,Turkey earthquake: Being buried alive with my newborn son,Necla Camuz was awake feeding her son when the earthquake hit. Moments later they were under mounds of rubble.,https://www.bbc.co.uk/news/world-middle-east-64620357,https://ichef.bbci.co.uk/news/1024/branded_news/16699/production/_128610819_babybest.jpg,2023-02-13T02:12:25Z,"It has been a week since a deadly earthquake struck Turkey and Syria, killing thousands. But amid the despair, there have also been stories of ""miracles"". This is one of them.
When Necla Camuz gave … [+5966 chars]",21,compound,-0.7311
22,id,bbc-news,https://www.facebook.com/bbcnews,Turkey-Syria earthquake: Satellite images show Jindayris devastation,More than 500 bodies have been pulled from the rubble of 200 destroyed buildings in Jindayris.,https://www.bbc.co.uk/news/world-middle-east-64643790,https://ichef.bbci.co.uk/news/1024/branded_news/E666/production/_128628985_mediaitem128628984.jpg,2023-02-14T20:24:58Z,"Satellite images of a small town in north-western Syria show the extent of the devastation wrought by last week's earthquake.
The head of the White Helmets group, which has been leading the rescue e… [+2258 chars]",22,compound,0.128
23,id,bbc-news,https://www.facebook.com/bbcnews,First UN aid convoy enters quake-hit Syria via new crossing,The UN says 11 lorries have driven through a reopened border crossing into rebel-held north-west Syria.,https://www.bbc.co.uk/news/world-middle-east-64645329,https://ichef.bbci.co.uk/news/1024/branded_news/1513D/production/_128633368_gettyimages-1247132481.jpg,2023-02-15T01:54:09Z,"The first UN aid convoy has entered through a reopened border crossing into rebel-held north-western Syria, devastated by last week's earthquake.
The UN said 11 lorries crossed from Turkey at Bab al… [+2335 chars]",23,compound,-0.6808
24,id,bbc-news,https://www.facebook.com/bbcnews,'You are a miracle': Rescues continue in Turkey almost 150 hours after quake,A seven-month-old baby and 12-year-old girl are among those pulled from the rubble.,https://www.bbc.co.uk/news/world-middle-east-64617245,https://ichef.bbci.co.uk/news/1024/branded_news/14EA6/production/_128607658_9e6954e956012f1222881b94aa84ceef3ea73a1e816_827_4646_26131000x563.jpg,2023-02-12T13:51:29Z,"Rescuers have pulled a seven-month-old baby from the rubble of a building in Hatay, southern Turkey, 139 hours after Monday's deadly earthquake.
Elsewhere in Hatay, a 12-year-old girl, Cudie, was sa… [+2403 chars]",24,compound,0.0
25,id,bbc-news,https://www.facebook.com/bbcnews,Earthquake-hit Syria to open two more border crossings for aid delivery - UN,"The two crossings into opposition-held north-western Syria will be open for three months, the UN says.",https://www.bbc.co.uk/news/world-middle-east-64632877,https://ichef.bbci.co.uk/news/1024/branded_news/8676/production/_128622443_0078b329-cd7b-4962-b8d7-b853df3f7619.jpg,2023-02-14T01:18:09Z,"Syria's government has agreed to open two more border crossings to allow aid into the country devastated by last week's deadly earthquake, the UN says.
""It's going to make a big difference. We are n… [+2592 chars]",25,compound,-0.25
26,id,bbc-news,https://www.facebook.com/bbcnews,"No tents, no aid, nothing: Why some Syrians feel forgotten","""We've received nothing but God's mercy,"" one earthquake survivor tells Quentin Sommerville.",https://www.bbc.co.uk/news/world-middle-east-64616897,https://ichef.bbci.co.uk/news/1024/branded_news/70C6/production/_128607882_photo-2023-02-12-10-14-28.jpg,2023-02-12T16:56:14Z,"The tents are so close to the border wall between Syria and Turkey, they are almost touching it. 
Those living here on the Syrian side may have been displaced by the country's more than decade-old c… [+6310 chars]",26,compound,0.0
27,id,bbc-news,https://www.facebook.com/bbcnews,Turkey-Syria earthquake: Fire at Turkey port adds to quake disruption,"Despite claims the fire had been extinguished, the BBC witnessed it still smouldering on Wednesday.",https://www.bbc.co.uk/news/world-europe-64570458,https://ichef.bbci.co.uk/news/1024/branded_news/10834/production/_128563676_fire2.jpg,2023-02-08T13:33:30Z,"A huge fire at one of Turkey's main ports has been extinguished, the defence ministry has said.
The blaze at Iskenderun, on Turkey's Mediterranean coast, was caused by Monday's earthquakes that have… [+772 chars]",27,compound,0.0772
28,id,bbc-news,https://www.facebook.com/bbcnews,Turkey condemns 'vile' Sweden Quran-burning protest,Turkey earlier called off a visit by Sweden's defence minister Pal Jonson over the planned protest.,https://www.bbc.co.uk/news/world-europe-64360528,https://ichef.bbci.co.uk/news/1024/branded_news/F057/production/_128372516_stockholm2.jpg,2023-01-21T16:42:08Z,"Turkey has condemned the burning of a copy of the Quran during a protest in Sweden, describing it as a ""vile act"".
It said the Swedish government's decision to allow the protest to go ahead was ""com… [+2074 chars]",28,compound,-0.8442
29,id,bbc-news,,Building collapses in Turkey after deadly earthquake,Footage from Sanliurfa province shows people running for cover as the multi-storey building comes down.,https://www.bbc.co.uk/news/av/world-europe-64535666,https://ichef.bbci.co.uk/news/1024/branded_news/15B83/production/_128536988_p0f1bv28.jpg,2023-02-06T12:25:45Z,"Footage from the Haliliye district in Sanliurfa, Turkey, shows people running for cover as a multi-storey building collapses, hours after a deadly earthquake hits the region. 
A rescue operation is … [+139 chars]",29,compound,0.2732
30,id,bbc-news,https://www.facebook.com/bbcnews,Turkey earthquake: The world rallies in the face of disaster,See in pictures how the world is rallying around Turkey and Syria following a devastating earthquake.,https://www.bbc.co.uk/news/world-europe-64550201,https://ichef.bbci.co.uk/news/1024/branded_news/AB4E/production/_128545834_93306c91b2e3a1025427df79966932246c6a5db90_487_5500_30951000x563.jpg,2023-02-07T04:55:18Z,"As Turkey and Syria begin to assess the damage caused by a 7.8 magnitude earthquake that has so far left at least 4,300 people dead, countries around the world have mobilised to help the rescue and r… [+2717 chars]",30,compound,-0.3612
31,id,bbc-news,https://www.facebook.com/bbcnews,Turkey earthquake: Bodies in street after quake as anger grows over aid,The death toll in Turkey continues to rise as survivors struggle to find shelter and support.,https://www.bbc.co.uk/news/world-europe-64560339,https://ichef.bbci.co.uk/news/1024/branded_news/1641D/production/_128556119_gettyimages-1246840787.jpg,2023-02-07T18:36:16Z,"Bodies of people killed in the earthquake in southern Turkey on Monday are being left out on the street as the hunt continues for survivors.
More than 5,000 people are known to have died in Turkey a… [+4728 chars]",31,compound,-0.8442
32,id,bbc-news,,Turkey earthquake: BBC reporter stops as rescuers listen for trapped people,"Tom Bateman was reporting from Adana, Turkey, when asked to be be quiet.",https://www.bbc.co.uk/news/av/world-europe-64567485,https://ichef.bbci.co.uk/news/1024/branded_news/8BDE/production/_128560853_p0f1qwfg.jpg,2023-02-08T09:24:19Z,"BBC Middle East correspondent Tom Bateman paused his live broadcast as rescue teams in Adana, Turkey, called for quiet. 
The search for survivors across southern Turkey and northern Syria continues … [+69 chars]",32,compound,0.5106
33,id,bbc-news,https://www.facebook.com/bbcnews,Turkey-Syria earthquake: New-born and mother saved after four days in rubble,Ten-day-old Yagiz was retrieved from ruins in southern Turkey following Monday's deadly earthquakes.,https://www.bbc.co.uk/news/world-europe-64593486,https://ichef.bbci.co.uk/news/1024/branded_news/11146/production/_128585996_fojquyaxgam2g3f.jpg,2023-02-10T08:09:59Z,"A new-born baby and his mother have been rescued from rubble in Turkey, around 90 hours after the first of Monday's deadly earthquakes.
The 10-day-old boy, named Yagiz, was retrieved from a ruined s… [+2359 chars]",33,compound,-0.0772
34,id,bbc-news,,Syria-Turkey earthquake: On the ground inspecting the damage near the epicentre,Video obtained by BBC News shows the destruction in the town of Gaziantep in Turkey.,https://www.bbc.co.uk/news/av/world-europe-64539605,https://ichef.bbci.co.uk/news/1024/branded_news/695D/production/_128537962_p0f1bryv.jpg,2023-02-06T12:14:31Z,"Video obtained by BBC News shows the destruction on the ground in a town near the epicentre of the earthquake.
Footage from Gaziantep shows piles of rubble and almost flattened buildings.
Follow th… [+67 chars]",34,compound,-0.5719
35,id,bbc-news,,Turkey port blaze: Video shows aid plane gliding through smoke,"Aerial footage shows thick, dark smoke billowing from a port in southern Turkey which reignited.",https://www.bbc.co.uk/news/av/world-europe-64584897,https://ichef.bbci.co.uk/news/1024/branded_news/60C9/production/_128577742_p0f22539.jpg,2023-02-09T14:11:22Z,"Aerial footage showed dense, black smoke billowing from a burning port in southern Turkey on Thursday, after it reignited again.
The blaze at Iskenderun - one of two main container ports on Turkey's… [+899 chars]",35,compound,0.0
36,id,bbc-news,,"Turkey earthquake: BBC reports from Antakya, a city reduced to rubble","The BBC's Quentin Sommerville has seen first hand the destruction in Antakya, a city in the south of Turkey.",https://www.bbc.co.uk/news/av/world-64561818,https://ichef.bbci.co.uk/news/1024/branded_news/103B/production/_128555140_p0f1mnqr.jpg,2023-02-07T17:10:54Z,"The BBC's Middle East correspondent Quentin Sommerville has seen first hand the destruction in Antakya, a city in the south of Turkey. He described the situation on the ground surrounded by fallen bu… [+186 chars]",36,compound,-0.4588
37,id,bbc-news,https://www.facebook.com/bbcnews,Turkey earthquake: Mexico sends its famed search and rescue dogs,Quake-prone Mexico has expert teams of humans and canines specialised in searching through rubble.,https://www.bbc.co.uk/news/world-latin-america-64553936,https://ichef.bbci.co.uk/news/1024/branded_news/134D9/production/_128556097_foxhe2vaeaivib1.jpg,2023-02-07T18:02:33Z,"Mexico is sending some of its famous search and rescue dogs to Turkey to help look for people buried under rubble following the earthquake.
A plane with 16 dogs on board took off from Mexico City ea… [+2607 chars]",37,compound,0.7184
38,id,bbc-news,,Turkey and Syria earthquake: Aerial footage shows Syria aftermath,"Drone footage shows the earthquake aftermath and the search and rescue operation in Idlib, Syria.",https://www.bbc.co.uk/news/av/world-middle-east-64539126,https://ichef.bbci.co.uk/news/1024/branded_news/17FB9/production/_128533289_p0f1b0hp.jpg,2023-02-06T10:46:49Z,"Drone images show the earthquake aftermath in the town of Sarmada in the countryside of the north western Syrian Idlib province in Syria.
Members of the Syrian civil defence, known as the White Helm… [+221 chars]",38,compound,0.1027
39,id,bbc-news,https://www.facebook.com/bbcnews,Hampshire firefighters in 25-hour earthquake rescue,The search and rescue specialists freed two people from a collapsed building in Hatay at the weekend.,https://www.bbc.co.uk/news/uk-england-hampshire-64635462,https://ichef.bbci.co.uk/news/1024/branded_news/1EAC/production/_128625870_firefighters_140223_onlinestill1.jpg,2023-02-14T11:29:32Z,"Media caption, After more than 24 hours the earthquake victim was eventually freed by the Hampshire team
A team of firefighters deployed from the UK have rescued a man and a woman more than a week a… [+2249 chars]",39,compound,0.5267
40,id,bbc-news,https://www.facebook.com/bbcnews,Syria earthquake baby Aya moved amid kidnap fears,Health officials reportedly take precautions to protect Aya from kidnapping and adoption fraud.,https://www.bbc.co.uk/news/world-middle-east-64649648,https://ichef.bbci.co.uk/news/1024/branded_news/13FAE/production/_128583818_mediaitem128583817.jpg,2023-02-15T12:57:53Z,"An orphaned Syrian baby born under the rubble of her collapsed home after last week's earthquake has been moved to a ""safe location"" by a health authority.
The Afrin Health Directorate took the prec… [+2452 chars]",40,compound,0.2732
41,id,bbc-news,,BBC on the scene of earthquake devastation in Turkey,"Anna Foster is in Adana, one of the cities hit by the earthquakes.",https://www.bbc.co.uk/news/av/world-europe-64546246,https://ichef.bbci.co.uk/news/1024/branded_news/1806E/production/_128541489_p0f1dqwm.jpg,2023-02-06T16:54:17Z,"Rescue workers are racing to save people trapped in collapsed buildings after two powerful earthquakes devastated parts of southern Turkey and northern Syria.
Our Middle East Correspondent Anna Fost… [+64 chars]",41,compound,-0.0516
42,id,bbc-news,https://www.facebook.com/bbcnews,Iranian man who beheaded 17-year-old wife jailed for eight years,"The judiciary says the lenient sentence was due to the 17-year-old victim's parents ""pardoning"" him.",https://www.bbc.co.uk/news/world-middle-east-64319487,https://ichef.bbci.co.uk/news/1024/branded_news/18301/production/_128337099_mediaitem128337098.jpg,2023-01-18T14:44:12Z,"A man who beheaded his 17-year-old wife has been sentenced to eight years in prison in Iran, the judiciary says.
Images of Sajjad Heydari carrying Mona's severed head in Ahvaz after the so-called ""h… [+2527 chars]",42,compound,-0.7096
