row_id,Title,Score,Number_Of_Comments,Publish_Date,Link,sentiment_type,sentiment_score
0,Armenia sends second batch of humanitarian aid to Turkey though land border,24,0,1676442477.0,https://www.reddit.com/r/worldnews/comments/112re7x/armenia_sends_second_batch_of_humanitarian_aid_to/,compound,0.0
1,Rising toll makes quake deadliest in Turkey's modern history,76,8,1676414891.0,https://www.reddit.com/r/worldnews/comments/112iiyf/rising_toll_makes_quake_deadliest_in_turkeys/,compound,0.0
2,"Death toll from Turkey-Syria earthquake exceeds 41,000",1234,119,1676412603.0,https://www.reddit.com/r/worldnews/comments/112hnew/death_toll_from_turkeysyria_earthquake_exceeds/,compound,-0.5994
3,"Death toll in Turkey and Syria earthquake tops 41,000 as UN says rescue phase is coming to a close",114,4,1676412564.0,https://www.reddit.com/r/worldnews/comments/112hmuc/death_toll_in_turkey_and_syria_earthquake_tops/,compound,0.4019
4,Armenian Foreign Minister to visit Turkey,51,2,1676394208.0,https://www.reddit.com/r/worldnews/comments/112adn8/armenian_foreign_minister_to_visit_turkey/,compound,0.0
5,"I’m Jared Malsin, a Wall Street Journal reporter on the ground in southern Turkey after last week’s devastating earthquakes. Ask me anything.",308,105,1676387508.0,https://www.reddit.com/r/worldnews/comments/1127pqg/im_jared_malsin_a_wall_street_journal_reporter_on/,compound,-0.6486
6,Turkey and Syria earthquake rescue efforts wind down as survivors struggle to survive and death toll rises,46,5,1676385404.0,https://www.reddit.com/r/worldnews/comments/1126vg8/turkey_and_syria_earthquake_rescue_efforts_wind/,compound,-0.4404
7,Scammers profit from Turkey-Syria earthquake - BBC News,87,10,1676377134.0,https://www.reddit.com/r/worldnews/comments/11241cy/scammers_profit_from_turkeysyria_earthquake_bbc/,compound,0.4404
8,"Turkey, earthquake fall out takes political turn / Turkey / Areas / Homepage",24,2,1676376169.0,https://www.reddit.com/r/worldnews/comments/1123r23/turkey_earthquake_fall_out_takes_political_turn/,compound,0.0
9,"Rescue phase ‘comes to a close’ in Turkey-Syria quake disaster. The combined death toll surged above 37,000 and looks set to keep increasing.",63,4,1676332810.0,https://www.reddit.com/r/worldnews/comments/111o7c0/rescue_phase_comes_to_a_close_in_turkeysyria/,compound,-0.6908
10,"Anonymous Pakistani Donates $30 Million To Turkey Earthquake Victims As Death Toll Hits 33,000",172,24,1676332457.0,https://www.reddit.com/r/worldnews/comments/111o2rk/anonymous_pakistani_donates_30_million_to_turkey/,compound,-0.7351
11,"In Turkey, fears grow of Erdogan postponing elections as earthquake toll passes 30,000",1963,77,1676326423.0,https://www.reddit.com/r/worldnews/comments/111loba/in_turkey_fears_grow_of_erdogan_postponing/,compound,-0.5106
12,Turkey thanks Israeli rescue teams for 'solidarity' in earthquake aid,177,2,1676316174.0,https://www.reddit.com/r/worldnews/comments/111hi44/turkey_thanks_israeli_rescue_teams_for_solidarity/,compound,0.8126
13,Videos show Turkey's Erdogan boasted letting builders avoid earthquake codes,66770,1487,1676315923.0,https://www.reddit.com/r/worldnews/comments/111hef2/videos_show_turkeys_erdogan_boasted_letting/,compound,-0.296
14,"Turkey-Syria reconstruction costs to come to ‘billions of dollars,’ World Bank says",39,15,1676300827.0,https://www.reddit.com/r/worldnews/comments/111bc59/turkeysyria_reconstruction_costs_to_come_to/,compound,0.0
15,UN calls for earthquake aid access to Syria as rescues wind down in Turkey,35,2,1676295864.0,https://www.reddit.com/r/worldnews/comments/1118kab/un_calls_for_earthquake_aid_access_to_syria_as/,compound,0.3182
16,"Mongolia's military field hospital provides aid to more than 90 people in Antakya, Turkey",103,5,1676284390.0,https://www.reddit.com/r/worldnews/comments/11157v1/mongolias_military_field_hospital_provides_aid_to/,compound,0.0
17,"Nikos Christodoulides elected president of Cyprus, vows to revive peace talks with Turkey",92,12,1676281381.0,https://www.reddit.com/r/worldnews/comments/1114fsd/nikos_christodoulides_elected_president_of_cyprus/,compound,0.7096
18,"Death toll from earthquake in Turkey, Syria exceeds 33,000",140,12,1676276806.0,https://www.reddit.com/r/worldnews/comments/1113aqr/death_toll_from_earthquake_in_turkey_syria/,compound,-0.5994
19,"Amnesty in Turkey for Construction Violations Is Scrutinized After Quake: Survivors and building experts say poor construction most likely exacerbated the scale of the earthquake’s destruction, as the death toll in Turkey and Syria surpassed 33,000 people",277,12,1676251924.0,https://www.reddit.com/r/worldnews/comments/110vzoj/amnesty_in_turkey_for_construction_violations_is/,compound,-0.9337
20,Survivors band together in Turkey’s earthquake-hit Gaziantep,114,1,1676237592.0,https://www.reddit.com/r/worldnews/comments/110qwvr/survivors_band_together_in_turkeys_earthquakehit/,compound,0.0
21,"Some Israeli rescuers depart Turkey over safety fears, as locals fume at government",97,6,1676236830.0,https://www.reddit.com/r/worldnews/comments/110qmc3/some_israeli_rescuers_depart_turkey_over_safety/,compound,-0.296
22,"Earthquake death toll tops 33,000, Turkey starts legal action",5284,229,1676230719.0,https://www.reddit.com/r/worldnews/comments/110o7x2/earthquake_death_toll_tops_33000_turkey_starts/,compound,-0.0258
23,Sorrow turns to tension over Turkey's earthquake response,112,6,1676225198.0,https://www.reddit.com/r/worldnews/comments/110m1t1/sorrow_turns_to_tension_over_turkeys_earthquake/,compound,-0.6908
24,Israeli Rescue Team Leaves Turkey Over Security Fears,1673,220,1676215800.0,https://www.reddit.com/r/worldnews/comments/110ibno/israeli_rescue_team_leaves_turkey_over_security/,compound,0.4404
25,Qatar sending 10K World Cup container homes to Turkey and Syria.,4277,228,1676214750.0,https://www.reddit.com/r/worldnews/comments/110hxft/qatar_sending_10k_world_cup_container_homes_to/,compound,0.0
26,"Turkey: The Death Toll in the Earthquake Reached 29,605, Historical Artifacts Destroyed",434,13,1676211842.0,https://www.reddit.com/r/worldnews/comments/110gv69/turkey_the_death_toll_in_the_earthquake_reached/,compound,-0.7717
27,Terror Threat Forces United Hatzolah to Abruptly End Turkey Rescue Mission,65,12,1676211400.0,https://www.reddit.com/r/worldnews/comments/110gpmo/terror_threat_forces_united_hatzolah_to_abruptly/,compound,-0.1779
28,Turkey arrests building contractors 6 days after quakes,11546,588,1676196181.0,https://www.reddit.com/r/worldnews/comments/110c9gt/turkey_arrests_building_contractors_6_days_after/,compound,-0.4404
29,"Final death toll from Turkey-Syria quake will top 55,000, UN relief chief predicts",3458,119,1676195464.0,https://www.reddit.com/r/worldnews/comments/110c2qv/final_death_toll_from_turkeysyria_quake_will_top/,compound,0.0
30,Quake-hit Turkey issues 113 building arrest warrants,273,15,1676194239.0,https://www.reddit.com/r/worldnews/comments/110bral/quakehit_turkey_issues_113_building_arrest/,compound,-0.34
31,India sends seventh flight with relief to Turkey and Syria | Latest News India,219,22,1676189518.0,https://www.reddit.com/r/worldnews/comments/110alky/india_sends_seventh_flight_with_relief_to_turkey/,compound,0.4767
32,"Turkey-Syria earthquake: Death toll tops 29,000",265,24,1676184748.0,https://www.reddit.com/r/worldnews/comments/1109enb/turkeysyria_earthquake_death_toll_tops_29000/,compound,-0.1531
33,Romania to ensure transport to Turkey of temporary accommodation products from rescEU stockpile hosted on its territory - Ecopolitic News,109,1,1676182594.0,https://www.reddit.com/r/worldnews/comments/1108u0r/romania_to_ensure_transport_to_turkey_of/,compound,0.3818
34,Warning violence hampering earthquake rescue efforts in Turkey,130,5,1676171648.0,https://www.reddit.com/r/worldnews/comments/1105obk/warning_violence_hampering_earthquake_rescue/,compound,-0.4939
35,Turkey earthquake rescue disrupted by security concerns as death toll rises,79,5,1676149527.0,https://www.reddit.com/r/worldnews/comments/10zxxr8/turkey_earthquake_rescue_disrupted_by_security/,compound,0.2023
36,"Survivors are still being found as Turkey and Syria earthquake death toll tops 25,000",1976,51,1676138428.0,https://www.reddit.com/r/worldnews/comments/10ztn4p/survivors_are_still_being_found_as_turkey_and/,compound,-0.1531
37,German groups suspend Turkey quake rescue over security,118,14,1676137304.0,https://www.reddit.com/r/worldnews/comments/10zt7l3/german_groups_suspend_turkey_quake_rescue_over/,compound,0.5267
38,"Over 25,000 people have now been confirmed dead following earthquakes in Turkey and Syria. Rescue teams from Germany and Austria have halted their operations due to the worsening security situation",5951,338,1676132303.0,https://www.reddit.com/r/worldnews/comments/10zr98w/over_25000_people_have_now_been_confirmed_dead/,compound,-0.3818
39,Armenia sends humanitarian aid to Turkey through Margara Bridge,57,1,1676102560.0,https://www.reddit.com/r/worldnews/comments/10zfqhc/armenia_sends_humanitarian_aid_to_turkey_through/,compound,0.0
40,Anger grows at Erdoğan over Turkey’s earthquake response,29651,1187,1676073310.0,https://www.reddit.com/r/worldnews/comments/10z6rsq/anger_grows_at_erdoğan_over_turkeys_earthquake/,compound,-0.5719
41,"Death toll in Turkey-Syria earthquake surpasses 23,000",119,33,1676068703.0,https://www.reddit.com/r/worldnews/comments/10z52y6/death_toll_in_turkeysyria_earthquake_surpasses/,compound,-0.5994
42,"In Turkey and Syria, outdated building methods all but assured disaster from a quake",165,15,1676059894.0,https://www.reddit.com/r/worldnews/comments/10z1p2y/in_turkey_and_syria_outdated_building_methods_all/,compound,-0.5267
43,IDF teams rescue 10-year-old boy trapped under rubble for 100 hours in Turkey,1000,40,1676051451.0,https://www.reddit.com/r/worldnews/comments/10yy659/idf_teams_rescue_10yearold_boy_trapped_under/,compound,-0.0258
44,Indian army's field hospital in Turkey under 'Operation Dost' starts functioning,130,3,1676035777.0,https://www.reddit.com/r/worldnews/comments/10ys0us/indian_armys_field_hospital_in_turkey_under/,compound,0.0
45,"Mongolian rescuers save three people from rubble in Hatay, Turkey",343,1,1676027291.0,https://www.reddit.com/r/worldnews/comments/10ypag2/mongolian_rescuers_save_three_people_from_rubble/,compound,0.4939
46,"Turkey insults Pakistan, refuses to host PM Shehbaz Sharif",54,29,1676013318.0,https://www.reddit.com/r/worldnews/comments/10yj0h0/turkey_insults_pakistan_refuses_to_host_pm/,compound,-0.4215
47,US pledges $85m for Turkey-Syria earthquake relief,117,28,1676002248.0,https://www.reddit.com/r/worldnews/comments/10yfug7/us_pledges_85m_for_turkeysyria_earthquake_relief/,compound,0.4767
48,US pledges $85m for Turkey-Syria earthquake relief - BBC News,209,42,1675996815.0,https://www.reddit.com/r/worldnews/comments/10ye2b6/us_pledges_85m_for_turkeysyria_earthquake_relief/,compound,0.4767
49,Taiwan president to donate a month's salary for Turkey relief efforts,2310,87,1675991449.0,https://www.reddit.com/r/worldnews/comments/10yc4xn/taiwan_president_to_donate_a_months_salary_for/,compound,0.4767
