Title,Score,Number_Of_Comments,Publish_Date,Link,SentimentScore
Qatar sending 10K World Cup container homes to Turkey and Syria.,4287,228,1676214750.0,https://www.reddit.com/r/worldnews/comments/110hxft/qatar_sending_10k_world_cup_container_homes_to/,
Two EU lawmakers detained in Qatar bribery investigation,98,1,1676107454.0,https://www.reddit.com/r/worldnews/comments/10zgzhc/two_eu_lawmakers_detained_in_qatar_bribery/,
Qatar Bans Insect Food After EU Expands Menu For Protein,121,47,1675740307.0,https://www.reddit.com/r/worldnews/comments/10vr651/qatar_bans_insect_food_after_eu_expands_menu_for/,
Germany in talks with Qatar to ‘repurchase’ tanks: reports,134,4,1675598515.0,https://www.reddit.com/r/worldnews/comments/10uawic/germany_in_talks_with_qatar_to_repurchase_tanks/,
Leaked Documents Show Qatar Bribed Prominent Leaders a Month before the Collapse of Afghanistan - The Khaama Press News Agency,2582,90,1675554234.0,https://www.reddit.com/r/worldnews/comments/10tv0ky/leaked_documents_show_qatar_bribed_prominent/,
"Qatar does not advocate ‘forgive and forget’ for Russia, foreign minister says after colleague’s controversial remarks",358,20,1674029097.0,https://www.reddit.com/r/worldnews/comments/10f1vs8/qatar_does_not_advocate_forgive_and_forget_for/,
"The European Parliament announced its chief, Roberta Metsola, had launched ""an urgent procedure"" to lift the immunity of two MEPs amid a corruption scandal linked to Qatar. The parliament did not give the lawmakers' names but said it was in response to an investigation by Belgium",272,5,1672677759.0,https://www.reddit.com/r/worldnews/comments/101h1wu/the_european_parliament_announced_its_chief/,
"Hungary's PM Viktor Orban praises Qatar for protecting football from ""slipping into the danger of political interference"", describes World Cup 2022 as ""wonderful, distinguished, universal and exceptional in every way"".",60,37,1672000977.0,https://www.reddit.com/r/worldnews/comments/zv686e/hungarys_pm_viktor_orban_praises_qatar_for/,
Qatar Threatens EU Gas Supply Amid Corruption Probe,729,49,1671471786.0,https://www.reddit.com/r/worldnews/comments/zpy5hw/qatar_threatens_eu_gas_supply_amid_corruption/,
"EU-Qatar graft scandal uncovered by year-long, pan-Europe probe, Belgium says",793,94,1671371792.0,https://www.reddit.com/r/worldnews/comments/zoz6tq/euqatar_graft_scandal_uncovered_by_yearlong/,
Qatar threatens EU corruption accusations could impact gas deals,1096,131,1671371675.0,https://www.reddit.com/r/worldnews/comments/zoz5e4/qatar_threatens_eu_corruption_accusations_could/,
Qatar reiterates denial that its government involved in EU corruption case,148,10,1671368087.0,https://www.reddit.com/r/worldnews/comments/zoxzv6/qatar_reiterates_denial_that_its_government/,
New app offers Qatar’s migrant workers first definitive World Cup 2022 legacy | World Cup 2022,3,2,1671183462.0,https://www.reddit.com/r/worldnews/comments/znaudo/new_app_offers_qatars_migrant_workers_first/,
Corruption scandal: MEPs vote to suspend Qatar access to EU Parliament,251,6,1671124909.0,https://www.reddit.com/r/worldnews/comments/zmqmpc/corruption_scandal_meps_vote_to_suspend_qatar/,
Four in EU-Qatar bribery inquiry to stay in custody,19,3,1671111423.0,https://www.reddit.com/r/worldnews/comments/zml99j/four_in_euqatar_bribery_inquiry_to_stay_in_custody/,
"European far-right cheers over Qatar corruption scandal: For leaders like Marine Le Pen and Viktor Orbán, the European Parliament’s troubles are proof of EU double standards on the rule of law",101,27,1671087075.0,https://www.reddit.com/r/worldnews/comments/zmelat/european_farright_cheers_over_qatar_corruption/,
"EU-Qatar graft scandal uncovered by year-long, pan-Europe probe, Belgium says",84,2,1671048840.0,https://www.reddit.com/r/worldnews/comments/zm0yvp/euqatar_graft_scandal_uncovered_by_yearlong/,
"Lawmaker Eva Kaili, 3 others charged in alleged bribery scheme involving Qatar",201,5,1671043804.0,https://www.reddit.com/r/worldnews/comments/zlyyvm/lawmaker_eva_kaili_3_others_charged_in_alleged/,
Scottish worker dies after incident on Qatar rig,37,4,1671030544.0,https://www.reddit.com/r/worldnews/comments/zltf5e/scottish_worker_dies_after_incident_on_qatar_rig/,
Four charged in connection with Qatar corruption scandal at Brussels,49,5,1670956154.0,https://www.reddit.com/r/worldnews/comments/zl2ypq/four_charged_in_connection_with_qatar_corruption/,
"Greek MEP stripped of EU vice-president role amid Qatar scandal | Parliament’s senior leaders agree to remove Eva Kaili, a decision that will later be voted on by all 705 MEPs",156,4,1670934816.0,https://www.reddit.com/r/worldnews/comments/zkumpa/greek_mep_stripped_of_eu_vicepresident_role_amid/,
Qatar World Cup corruption scandal: European Parliament offices searched,1248,77,1670931747.0,https://www.reddit.com/r/worldnews/comments/zktph3/qatar_world_cup_corruption_scandal_european/,
EU parliament suspends Kaili's VP 'duties' over Qatar scandal,122,8,1670784258.0,https://www.reddit.com/r/worldnews/comments/zj3gyj/eu_parliament_suspends_kailis_vp_duties_over/,
Four people charged over Qatar’s alleged bribing of EU officials | European Union,849,30,1670776377.0,https://www.reddit.com/r/worldnews/comments/ziynyh/four_people_charged_over_qatars_alleged_bribing/,
"A Greek MEP was suspended as a vice president of the European Parliament Saturday over a corruption probe implicating World Cup hosts Qatar that has ensnared four others and sparked calls for ""root and branch reform"" in the EU institution",178,6,1670713427.0,https://www.reddit.com/r/worldnews/comments/zi6jh8/a_greek_mep_was_suspended_as_a_vice_president_of/,
European Parliament vice-president arrested in connection with Qatar corruption,3062,184,1670654387.0,https://www.reddit.com/r/worldnews/comments/zhl93d/european_parliament_vicepresident_arrested_in/,
"Belgian police arrested Greek socialist MEP Eva Kaili, a European Parliament vice-president, in connection with an investigation into corruption implicating World Cup hosts Qatar, the prosecutors office said Friday.",273,11,1670645639.0,https://www.reddit.com/r/worldnews/comments/zhijra/belgian_police_arrested_greek_socialist_mep_eva/,
Belgium detains four over suspected Qatar bribes at EU parliament,173,8,1670618762.0,https://www.reddit.com/r/worldnews/comments/zh88hs/belgium_detains_four_over_suspected_qatar_bribes/,
Qatar construction firm still operating despite not paying migrant workers,149,9,1670595323.0,https://www.reddit.com/r/worldnews/comments/zgyfxa/qatar_construction_firm_still_operating_despite/,
"Qatar’s gas output increase could cause catastrophic global heating, report says",35,4,1670577492.0,https://www.reddit.com/r/worldnews/comments/zgs8nq/qatars_gas_output_increase_could_cause/,
"World Cup draws 765,000 visitors to Qatar in first 2 weeks, falling short of 1.2 million expected",7328,813,1670570286.0,https://www.reddit.com/r/worldnews/comments/zgq0uv/world_cup_draws_765000_visitors_to_qatar_in_first/,
Qatar probing death of a worker at World Cup training site,32,8,1670522541.0,https://www.reddit.com/r/worldnews/comments/zg6azb/qatar_probing_death_of_a_worker_at_world_cup/,
'Qatar hosting the safest FIFA World Cup' - FIFA official says,0,42,1670515423.0,https://www.reddit.com/r/worldnews/comments/zg33gu/qatar_hosting_the_safest_fifa_world_cup_fifa/,
Australian man says he was booted from Qatar Airways flight because of his disability,251,33,1670483059.0,https://www.reddit.com/r/worldnews/comments/zfrvvp/australian_man_says_he_was_booted_from_qatar/,
Activists take Qatar workers protest to FIFA boss's home town,392,12,1670458463.0,https://www.reddit.com/r/worldnews/comments/zfiz3b/activists_take_qatar_workers_protest_to_fifa/,
"Qatar World Cup whistleblower was tortured, claim human rights groups",1618,26,1670442510.0,https://www.reddit.com/r/worldnews/comments/zfbk0s/qatar_world_cup_whistleblower_was_tortured_claim/,
UAE leader makes surprise visit to Qatar following boycott,48,3,1670285090.0,https://www.reddit.com/r/worldnews/comments/zdoyzx/uae_leader_makes_surprise_visit_to_qatar/,
European Parliament Committe approves Schengen visa exemption for Qatar citizens,24,2,1669904390.0,https://www.reddit.com/r/worldnews/comments/z9p1jg/european_parliament_committe_approves_schengen/,
"Deforestation in the Brazilian Amazon destroyed an area bigger than Qatar in the 12 months through July, according to official figures released Wednesday, which showed a decline from the year before -- but a sharp increase overall under outgoing President Jair Bolsonaro",278,13,1669851798.0,https://www.reddit.com/r/worldnews/comments/z97gd9/deforestation_in_the_brazilian_amazon_destroyed/,
Germany: Huge candle action commemorates Qatar worker deaths – DW,192,14,1669775591.0,https://www.reddit.com/r/worldnews/comments/z8ej5d/germany_huge_candle_action_commemorates_qatar/,
Germany agrees 15-year liquid gas supply deal with Qatar,145,44,1669765353.0,https://www.reddit.com/r/worldnews/comments/z8a9fw/germany_agrees_15year_liquid_gas_supply_deal_with/,
"Germany to get new Qatari LNG flows through QatarEnergy, ConocoPhillips deal",50,15,1669748449.0,https://www.reddit.com/r/worldnews/comments/z82qcn/germany_to_get_new_qatari_lng_flows_through/,
Qatar says worker deaths for World Cup 'between 400 and 500',74,34,1669723680.0,https://www.reddit.com/r/worldnews/comments/z7s9ic/qatar_says_worker_deaths_for_world_cup_between/,
Qatar agrees long-term gas supply deal with Germany: energy minister,30,9,1669711747.0,https://www.reddit.com/r/worldnews/comments/z7obwi/qatar_agrees_longterm_gas_supply_deal_with/,
Qatar and Germany sign long-term natural gas agreement,427,210,1669710321.0,https://www.reddit.com/r/worldnews/comments/z7nw7s/qatar_and_germany_sign_longterm_natural_gas/,
IRGC Man Says Qatar Helping Iran Silence Dissidents In World Cup,179,4,1669643780.0,https://www.reddit.com/r/worldnews/comments/z6x8dz/irgc_man_says_qatar_helping_iran_silence/,
Taliban profited from subcontracting stadium construction equipment in Qatar,1303,62,1669626821.0,https://www.reddit.com/r/worldnews/comments/z6rubn/taliban_profited_from_subcontracting_stadium/,
Police used water cannon and teargas after coming under attack from football supporters who brought havoc to the center of Brussels on Sunday following Morocco's shock 2-0 World Cup win over Belgium in Qatar,179,33,1669571330.0,https://www.reddit.com/r/worldnews/comments/z67k66/police_used_water_cannon_and_teargas_after_coming/,
Turkey in final stage talks for up to $10 bln funding from Qatar -sources,39,10,1669385457.0,https://www.reddit.com/r/worldnews/comments/z4eb5a/turkey_in_final_stage_talks_for_up_to_10_bln/,
EU lawmakers want FIFA to help families of Qatar workers | The European Parliament passed the resolution urging FIFA to help compensate the families of workers who died in Qatar during preparations for the World Cup.,134,15,1669310055.0,https://www.reddit.com/r/worldnews/comments/z3pdrg/eu_lawmakers_want_fifa_to_help_families_of_qatar/,
