row_id,Title,Score,Number_Of_Comments,Publish_Date,Link,sentiment_type,sentiment_score
0,"Death toll from Turkey-Syria earthquake exceeds 41,000",1230,119,1676412603.0,https://www.reddit.com/r/worldnews/comments/112hnew/death_toll_from_turkeysyria_earthquake_exceeds/,compound,-0.5994
1,"Death toll in Turkey and Syria earthquake tops 41,000 as UN says rescue phase is coming to a close",116,4,1676412564.0,https://www.reddit.com/r/worldnews/comments/112hmuc/death_toll_in_turkey_and_syria_earthquake_tops/,compound,0.4019
2,Syria White Helmets criticise UN over Assad say on aid deliveries,30,1,1676398858.0,https://www.reddit.com/r/worldnews/comments/112c8cp/syria_white_helmets_criticise_un_over_assad_say/,compound,-0.4404
3,"I’m Jared Malsin, a Wall Street Journal reporter on the ground in southern Turkey after last week’s devastating earthquakes. Ask me anything.",304,105,1676387508.0,https://www.reddit.com/r/worldnews/comments/1127pqg/im_jared_malsin_a_wall_street_journal_reporter_on/,compound,-0.6486
4,Turkey and Syria earthquake rescue efforts wind down as survivors struggle to survive and death toll rises,47,5,1676385404.0,https://www.reddit.com/r/worldnews/comments/1126vg8/turkey_and_syria_earthquake_rescue_efforts_wind/,compound,-0.4404
5,Scammers profit from Turkey-Syria earthquake - BBC News,91,10,1676377134.0,https://www.reddit.com/r/worldnews/comments/11241cy/scammers_profit_from_turkeysyria_earthquake_bbc/,compound,0.4404
6,These EU Countries Have Eased Visa Rules for Türkiye & Syria Earthquake Victims,13,1,1676368491.0,https://www.reddit.com/r/worldnews/comments/1120cby/these_eu_countries_have_eased_visa_rules_for/,compound,-0.0258
7,"Rescue phase ‘comes to a close’ in Turkey-Syria quake disaster. The combined death toll surged above 37,000 and looks set to keep increasing.",66,4,1676332810.0,https://www.reddit.com/r/worldnews/comments/111o7c0/rescue_phase_comes_to_a_close_in_turkeysyria/,compound,-0.6908
8,"Turkey-Syria reconstruction costs to come to ‘billions of dollars,’ World Bank says",40,15,1676300827.0,https://www.reddit.com/r/worldnews/comments/111bc59/turkeysyria_reconstruction_costs_to_come_to/,compound,0.0
9,UN calls for earthquake aid access to Syria as rescues wind down in Turkey,34,2,1676295864.0,https://www.reddit.com/r/worldnews/comments/1118kab/un_calls_for_earthquake_aid_access_to_syria_as/,compound,0.3182
10,"Death toll from earthquake in Turkey, Syria exceeds 33,000",142,12,1676276806.0,https://www.reddit.com/r/worldnews/comments/1113aqr/death_toll_from_earthquake_in_turkey_syria/,compound,-0.5994
11,"Amnesty in Turkey for Construction Violations Is Scrutinized After Quake: Survivors and building experts say poor construction most likely exacerbated the scale of the earthquake’s destruction, as the death toll in Turkey and Syria surpassed 33,000 people",274,12,1676251924.0,https://www.reddit.com/r/worldnews/comments/110vzoj/amnesty_in_turkey_for_construction_violations_is/,compound,-0.9337
12,Qatar sending 10K World Cup container homes to Turkey and Syria.,4284,228,1676214750.0,https://www.reddit.com/r/worldnews/comments/110hxft/qatar_sending_10k_world_cup_container_homes_to/,compound,0.0
13,"Final death toll from Turkey-Syria quake will top 55,000, UN relief chief predicts",3470,119,1676195464.0,https://www.reddit.com/r/worldnews/comments/110c2qv/final_death_toll_from_turkeysyria_quake_will_top/,compound,0.0
14,India sends seventh flight with relief to Turkey and Syria | Latest News India,219,22,1676189518.0,https://www.reddit.com/r/worldnews/comments/110alky/india_sends_seventh_flight_with_relief_to_turkey/,compound,0.4767
15,"Turkey-Syria earthquake: Death toll tops 29,000",263,24,1676184748.0,https://www.reddit.com/r/worldnews/comments/1109enb/turkeysyria_earthquake_death_toll_tops_29000/,compound,-0.1531
16,"US provides $85 mln humanitarian aid to Türkiye, Syria - Türkiye News",90,43,1676146720.0,https://www.reddit.com/r/worldnews/comments/10zwuzt/us_provides_85_mln_humanitarian_aid_to_türkiye/,compound,0.0
17,"Survivors are still being found as Turkey and Syria earthquake death toll tops 25,000",1972,51,1676138428.0,https://www.reddit.com/r/worldnews/comments/10ztn4p/survivors_are_still_being_found_as_turkey_and/,compound,-0.1531
18,"Over 25,000 people have now been confirmed dead following earthquakes in Turkey and Syria. Rescue teams from Germany and Austria have halted their operations due to the worsening security situation",5960,338,1676132303.0,https://www.reddit.com/r/worldnews/comments/10zr98w/over_25000_people_have_now_been_confirmed_dead/,compound,-0.3818
19,"Brazil, Switzerland request Security Council meeting on quake-hit Syria",45,3,1676132260.0,https://www.reddit.com/r/worldnews/comments/10zr8ma/brazil_switzerland_request_security_council/,compound,0.34
20,US and EU offer disaster aid with caveats in Syria’s government-controlled areas,24,0,1676104523.0,https://www.reddit.com/r/worldnews/comments/10zg8uz/us_and_eu_offer_disaster_aid_with_caveats_in/,compound,-0.6249
21,UAE sends aid to Syria | MEO,24,0,1676103839.0,https://www.reddit.com/r/worldnews/comments/10zg2ag/uae_sends_aid_to_syria_meo/,compound,0.0
22,UN calls for 'immediate ceasefire' in Syria to facilitate bringing aid to quake victims,213,10,1676079219.0,https://www.reddit.com/r/worldnews/comments/10z8tnb/un_calls_for_immediate_ceasefire_in_syria_to/,compound,-0.3182
23,US announces 180-day exemption to Syria sanctions for disaster aid,1230,85,1676071254.0,https://www.reddit.com/r/worldnews/comments/10z612q/us_announces_180day_exemption_to_syria_sanctions/,compound,-0.6249
24,"Death toll in Turkey-Syria earthquake surpasses 23,000",118,33,1676068703.0,https://www.reddit.com/r/worldnews/comments/10z52y6/death_toll_in_turkeysyria_earthquake_surpasses/,compound,-0.5994
25,"In Turkey and Syria, outdated building methods all but assured disaster from a quake",162,15,1676059894.0,https://www.reddit.com/r/worldnews/comments/10z1p2y/in_turkey_and_syria_outdated_building_methods_all/,compound,-0.5267
26,"'World forgot about Syria,' says WHO as aid trickles in",123,19,1676052932.0,https://www.reddit.com/r/worldnews/comments/10yyrkn/world_forgot_about_syria_says_who_as_aid_trickles/,compound,0.0516
27,Pressure mounts on UN to provide urgent support to north-western Syria,46,1,1676026182.0,https://www.reddit.com/r/worldnews/comments/10yoy9l/pressure_mounts_on_un_to_provide_urgent_support/,compound,0.3182
28,US pledges $85m for Turkey-Syria earthquake relief,117,28,1676002248.0,https://www.reddit.com/r/worldnews/comments/10yfug7/us_pledges_85m_for_turkeysyria_earthquake_relief/,compound,0.4767
29,US pledges $85m for Turkey-Syria earthquake relief - BBC News,212,42,1675996815.0,https://www.reddit.com/r/worldnews/comments/10ye2b6/us_pledges_85m_for_turkeysyria_earthquake_relief/,compound,0.4767
30,"Aid to quake-hit Syria slowed by sanctions, war's divisions",29,1,1675966853.0,https://www.reddit.com/r/worldnews/comments/10y1vzw/aid_to_quakehit_syria_slowed_by_sanctions_wars/,compound,-0.5994
31,"U.N. aid convoy enters Syria from Turkey, as toll from quakes passes 19,000",30,7,1675956939.0,https://www.reddit.com/r/worldnews/comments/10xxp85/un_aid_convoy_enters_syria_from_turkey_as_toll/,compound,0.0
32,Turkey-Syria earthquake: First aid convoy reaches opposition-held Idlib,34,1,1675950799.0,https://www.reddit.com/r/worldnews/comments/10xva52/turkeysyria_earthquake_first_aid_convoy_reaches/,compound,0.0516
33,"Death toll in Turkey, Syria earthquake surpasses 15,000",455,32,1675919653.0,https://www.reddit.com/r/worldnews/comments/10xm84q/death_toll_in_turkey_syria_earthquake_surpasses/,compound,-0.5994
34,"Armenian rescue team arrives in Syria, plane with humanitarian aid due later today",52,3,1675880855.0,https://www.reddit.com/r/worldnews/comments/10x6rlz/armenian_rescue_team_arrives_in_syria_plane_with/,compound,0.5106
35,"Egyptian rescue team, three military planes loaded with relief aid arrive in Syria following earthquake: Syrian sources",37,3,1675879378.0,https://www.reddit.com/r/worldnews/comments/10x65qx/egyptian_rescue_team_three_military_planes_loaded/,compound,0.7506
36,Pakistan dispatches relief aid to earthquake-hit Syria,11,6,1675872501.0,https://www.reddit.com/r/worldnews/comments/10x2r06/pakistan_dispatches_relief_aid_to_earthquakehit/,compound,0.4767
37,"Syria, Turkey earthquake: Saudi Arabia’s KSRelief officially launches aid program",32,8,1675857685.0,https://www.reddit.com/r/worldnews/comments/10wuwy5/syria_turkey_earthquake_saudi_arabias_ksrelief/,compound,0.0
38,Islamic State militants break out of prison during Syria earthquake chaos,50,1,1675856798.0,https://www.reddit.com/r/worldnews/comments/10wumhi/islamic_state_militants_break_out_of_prison/,compound,-0.7906
39,"Hope fading as deaths in Turkey, Syria quake pass 11,000",2708,193,1675855255.0,https://www.reddit.com/r/worldnews/comments/10wu612/hope_fading_as_deaths_in_turkey_syria_quake_pass/,compound,0.4404
40,"Taliban administration to send earthquake aid to Turkey, Syria",29,11,1675847119.0,https://www.reddit.com/r/worldnews/comments/10ws0zt/taliban_administration_to_send_earthquake_aid_to/,compound,0.0
41,India hands over six tonnes of relief materials to earthquake-hit Syria,129,12,1675843800.0,https://www.reddit.com/r/worldnews/comments/10wr6cm/india_hands_over_six_tonnes_of_relief_materials/,compound,0.4767
42,"Unesco sounds alarm over quake damage to Turkiye, Syria heritage",102,2,1675813763.0,https://www.reddit.com/r/worldnews/comments/10wh6ur/unesco_sounds_alarm_over_quake_damage_to_turkiye/,compound,-0.6808
43,Syria accused of playing politics with aid in aftermath of earthquake | Dispute with Damascus over who controls aid hinders efforts to get supplies into rebel-held north,33,3,1675806542.0,https://www.reddit.com/r/worldnews/comments/10we861/syria_accused_of_playing_politics_with_aid_in/,compound,-0.5719
44,"UAE President announces $100-million relief fund for earthquake victims in Syria, Turkey",82,3,1675800249.0,https://www.reddit.com/r/worldnews/comments/10wbk6r/uae_president_announces_100million_relief_fund/,compound,0.2023
45,Syria: Assad forces bombed areas hit by earthquake hours after disaster,2796,205,1675791352.0,https://www.reddit.com/r/worldnews/comments/10w7ssv/syria_assad_forces_bombed_areas_hit_by_earthquake/,compound,-0.6249
46,Swiss humanitarian aid deployed in Turkey and Syria,85,1,1675786870.0,https://www.reddit.com/r/worldnews/comments/10w5w4e/swiss_humanitarian_aid_deployed_in_turkey_and/,compound,0.0
47,"Syria accused of playing politics with aid in aftermath of earthquake, after controversy over whether regime or rebels would be tasked with delivery",38,3,1675768324.0,https://www.reddit.com/r/worldnews/comments/10vzay9/syria_accused_of_playing_politics_with_aid_in/,compound,-0.296
48,"India to send C130 aircraft carrying medicines to Syria, 2 more C17s with relief material to leave for Turkey",231,68,1675767341.0,https://www.reddit.com/r/worldnews/comments/10vz10w/india_to_send_c130_aircraft_carrying_medicines_to/,compound,0.4902
49,'Request was received': Israel to send earthquake relief to Syria as well as Turkey,104,4,1675760273.0,https://www.reddit.com/r/worldnews/comments/10vx8jw/request_was_received_israel_to_send_earthquake/,compound,0.6369
