row_id,Title,Score,Number_Of_Comments,Publish_Date,Link,sentiment_type,sentiment_score
0,Russian foreign minister Sergei Lavrov arrived in Iraq on Sunday,77,18,1675659311.0,https://www.reddit.com/r/worldnews/comments/10uy1le/russian_foreign_minister_sergei_lavrov_arrived_in/,compound,0.0
1,Ex-pilot who bombed Iraq nuke reactor walks back comment justifying PM assassination,47,5,1675580303.0,https://www.reddit.com/r/worldnews/comments/10u6c9h/expilot_who_bombed_iraq_nuke_reactor_walks_back/,compound,-0.5994
2,"DW cancels filming in Baghdad amid Iraqi government threats | Abdul Karim and other staff members of Deutsche Welle, Germany's international broadcaster, had to leave Iraq on short notice on Thursday morning due to security concerns.",96,1,1675356955.0,https://www.reddit.com/r/worldnews/comments/10run69/dw_cancels_filming_in_baghdad_amid_iraqi/,compound,-0.3612
3,Iran-backed group claims rocket attack on Turkish base in Kurdish Iraq,51,0,1675266965.0,https://www.reddit.com/r/worldnews/comments/10qy4ab/iranbacked_group_claims_rocket_attack_on_turkish/,compound,-0.4588
4,"Drones attacked a convoy of trucks in eastern Syria Sunday night shortly after it crossed into the country from Iraq, Syrian opposition activists and a pro-government radio station said. There was no immediate word on casualties",58,4,1675058063.0,https://www.reddit.com/r/worldnews/comments/10ou9ue/drones_attacked_a_convoy_of_trucks_in_eastern/,compound,-0.6369
5,Aircraft said to strike convoy of Iranian militia trucks on Syria-Iraq border,293,28,1675041916.0,https://www.reddit.com/r/worldnews/comments/10ooule/aircraft_said_to_strike_convoy_of_iranian_militia/,compound,-0.128
6,Truck convoy attacked on Syria-Iraq border - report,117,13,1675026586.0,https://www.reddit.com/r/worldnews/comments/10oiphg/truck_convoy_attacked_on_syriairaq_border_report/,compound,-0.4588
7,Artist asks British Museum to return Assyrian treasure to Iraq in swap,52,10,1674487752.0,https://www.reddit.com/r/worldnews/comments/10jf4ms/artist_asks_british_museum_to_return_assyrian/,compound,0.296
8,"Stampede kills 1, injures 60 in Iraq",13,1,1674121959.0,https://www.reddit.com/r/worldnews/comments/10fxub6/stampede_kills_1_injures_60_in_iraq/,compound,-0.743
9,Germany in talks with Iraq over possible gas imports - Chancellor,228,35,1673817070.0,https://www.reddit.com/r/worldnews/comments/10cv31j/germany_in_talks_with_iraq_over_possible_gas/,compound,0.0
10,"Germany's lower house of parliament will next week recognise the 2014 massacre of Yazidis by Islamic State group jihadists in Iraq as a ""genocide""",197,12,1673632523.0,https://www.reddit.com/r/worldnews/comments/10b0tyq/germanys_lower_house_of_parliament_will_next_week/,compound,-0.296
11,"German court opens trial of suspected 'Islamic State' member | A 37-year-old German woman is accused of crimes against humanity for her time with the so-called ""Islamic State."" Nadine K. is accused of ""enslaving"" a Yazidi woman in Syria and Iraq.",88,11,1673466508.0,https://www.reddit.com/r/worldnews/comments/109dzk1/german_court_opens_trial_of_suspected_islamic/,compound,-0.6486
12,Iraqi defence shot down drone over Iraq's Ain al-Asad air base,78,5,1673190570.0,https://www.reddit.com/r/worldnews/comments/106lfte/iraqi_defence_shot_down_drone_over_iraqs_ain/,compound,0.1027
13,A Turkish court Thursday refused to release a top doctor who faces years in jail for demanding a probe into the army's alleged use of chemical weapons against Kurdish fighters in Iraq. Turkish Medical Association head Sebnem Korur Fincanci was detained in October,452,12,1672338558.0,https://www.reddit.com/r/worldnews/comments/zycfhv/a_turkish_court_thursday_refused_to_release_a_top/,compound,-0.7964
14,"Gunmen in northern Iraq where remnants of the Islamic State group are active blew up a vehicle carrying policeman before opening fire killing nine, police sources said Sunday",57,1,1671384928.0,https://www.reddit.com/r/worldnews/comments/zp3qyw/gunmen_in_northern_iraq_where_remnants_of_the/,compound,-0.6249
15,3 killed in explosion north of Baghdad: Iraq's military - Times of India,10,0,1671028617.0,https://www.reddit.com/r/worldnews/comments/zlslla/3_killed_in_explosion_north_of_baghdad_iraqs/,compound,-0.6705
16,Russia replaces Iraq as top oil supplier to India in Nov,180,92,1671028078.0,https://www.reddit.com/r/worldnews/comments/zlsd80/russia_replaces_iraq_as_top_oil_supplier_to_india/,compound,0.2023
17,Top Israeli general claims attack on convoy at Iraq-Syria border,27,1,1671018044.0,https://www.reddit.com/r/worldnews/comments/zlorrw/top_israeli_general_claims_attack_on_convoy_at/,compound,-0.3182
18,"Egypt returns 176 recovered coin artefacts to Iraq, China, Saudi Arabia & Jordan",137,7,1670957400.0,https://www.reddit.com/r/worldnews/comments/zl3hxc/egypt_returns_176_recovered_coin_artefacts_to/,compound,0.0
19,Iraq’s Parliament Speaker Confirms Killing Of Thousands By Iran-Backed Militia,112,3,1670850847.0,https://www.reddit.com/r/worldnews/comments/zjysfq/iraqs_parliament_speaker_confirms_killing_of/,compound,-0.6486
20,Al Sadr launches campaign against homosexuality in Iraq,161,63,1670106540.0,https://www.reddit.com/r/worldnews/comments/zbspx5/al_sadr_launches_campaign_against_homosexuality/,compound,0.0
21,Iran-linked militia in Iraq threatens Saudi Arabia as Iraqi PM visits Tehran,48,1,1670074045.0,https://www.reddit.com/r/worldnews/comments/zbgagv/iranlinked_militia_in_iraq_threatens_saudi_arabia/,compound,-0.3818
22,"Iraq has recovered ""part"" of $2.5 billion in public funds fraudulently withdrawn from a government account, the prime minister said Sunday, calling on guilty parties to hand themselves in and return all the money",373,12,1669579260.0,https://www.reddit.com/r/worldnews/comments/z6axtf/iraq_has_recovered_part_of_25_billion_in_public/,compound,0.4767
23,Northern Iraq and the Kurdistani Disputed Territories,18,0,1669319865.0,https://www.reddit.com/r/worldnews/comments/z3t4wy/northern_iraq_and_the_kurdistani_disputed/,compound,-0.34
24,Salt and drought decimate buffaloes in Iraq's southern marshes,51,2,1669214890.0,https://www.reddit.com/r/worldnews/comments/z2r0d1/salt_and_drought_decimate_buffaloes_in_iraqs/,compound,0.0
25,"Erdogan signals a Turkish ground offensive in Syria, Iraq",45,52,1669141519.0,https://www.reddit.com/r/worldnews/comments/z20uvu/erdogan_signals_a_turkish_ground_offensive_in/,compound,-0.4588
26,Auditors in Iraq uncover staggering $2.5 billion tax fraud,4386,149,1669060369.0,https://www.reddit.com/r/worldnews/comments/z18dsf/auditors_in_iraq_uncover_staggering_25_billion/,compound,-0.5859
27,"Blaming Kurds for unrest, Iran threatens Iraq with offensive",4492,483,1669048918.0,https://www.reddit.com/r/worldnews/comments/z13im9/blaming_kurds_for_unrest_iran_threatens_iraq_with/,compound,-0.8316
28,Islamic Republic Intensifying Attacks On Kurdish Targets In Iran And Iraq,74,3,1669046899.0,https://www.reddit.com/r/worldnews/comments/z12poi/islamic_republic_intensifying_attacks_on_kurdish/,compound,-0.4404
29,Iran’s Revolutionary Guards Continue to Target Kurdish Opposition in Iraq,75,3,1669035406.0,https://www.reddit.com/r/worldnews/comments/z0yc2g/irans_revolutionary_guards_continue_to_target/,compound,0.0
30,"Turkey strikes in Syria, Iraq a week after Istanbul bombing",69,4,1668950420.0,https://www.reddit.com/r/worldnews/comments/z03ynl/turkey_strikes_in_syria_iraq_a_week_after/,compound,-0.3612
31,"Turkish air strikes destroy 89 Kurdish militant targets in Syria, Iraq, ministry says",38,31,1668944401.0,https://www.reddit.com/r/worldnews/comments/z020wj/turkish_air_strikes_destroy_89_kurdish_militant/,compound,-0.7184
32,"Blaming Kurds for unrest, Iran threatens Iraq with offensive",740,137,1668793960.0,https://www.reddit.com/r/worldnews/comments/yyq5sb/blaming_kurds_for_unrest_iran_threatens_iraq_with/,compound,-0.8316
33,Iran launches missile attacks on Kurdish opposition group in Iraq,146,9,1668483960.0,https://www.reddit.com/r/worldnews/comments/yvlwrd/iran_launches_missile_attacks_on_kurdish/,compound,-0.4404
34,"Iran rockets hit Kurdish party HQ near Iraq’s Erbil, kill one",40,2,1668411088.0,https://www.reddit.com/r/worldnews/comments/yus1c3/iran_rockets_hit_kurdish_party_hq_near_iraqs/,compound,-0.4588
35,Iran-linked militia group claims responsibility for murder of American aid worker in Iraq,130,10,1668120677.0,https://www.reddit.com/r/worldnews/comments/yrua6p/iranlinked_militia_group_claims_responsibility/,compound,-0.6908
36,Israel blamed for deadly strike on Iranian convoy at Syria-Iraq border,605,70,1668017788.0,https://www.reddit.com/r/worldnews/comments/yqqu00/israel_blamed_for_deadly_strike_on_iranian_convoy/,compound,-0.5574
37,"Russia elbows out Iraq, Saudi to be India’s top oil supplier",94,24,1667444310.0,https://www.reddit.com/r/worldnews/comments/ykqgcl/russia_elbows_out_iraq_saudi_to_be_indias_top_oil/,compound,0.2023
38,"Explosion in Iraq kills 10, injures at least 20",58,3,1667092266.0,https://www.reddit.com/r/worldnews/comments/yh0trd/explosion_in_iraq_kills_10_injures_at_least_20/,compound,-0.5423
39,Iraq gets a new government after a year of deadlock: Lawmakers have finally given the go-ahead to form a government after months of bitter infighting. New Prime Minister Mohammed Shia al-Sudani is facing many tough challenges,46,2,1666920788.0,https://www.reddit.com/r/worldnews/comments/yf9x7k/iraq_gets_a_new_government_after_a_year_of/,compound,-0.6597
40,Iraq’s parliament approves new government | Politics News,10,0,1666915969.0,https://www.reddit.com/r/worldnews/comments/yf80me/iraqs_parliament_approves_new_government_politics/,compound,0.4019
41,Iraq parliament approves new government after year of deadlock,34,2,1666909170.0,https://www.reddit.com/r/worldnews/comments/yf58wd/iraq_parliament_approves_new_government_after/,compound,0.0772
42,"Archaeologists Unearth 2,700-Year-Old Stone Carvings in Northern Iraq",521,34,1666637467.0,https://www.reddit.com/r/worldnews/comments/ycjaln/archaeologists_unearth_2700yearold_stone_carvings/,compound,0.0
43,"Iraq, Algeria, Oman, Kuwait and Bahrain Affirm Support for OPEC+ Production Cut",28,4,1666433228.0,https://www.reddit.com/r/worldnews/comments/yajt5g/iraq_algeria_oman_kuwait_and_bahrain_affirm/,compound,0.1531
44,"2,700-Year-Old Rock Carvings Discovered in Iraq During Restoration of Damaged Mashki Gate",91,4,1666289619.0,https://www.reddit.com/r/worldnews/comments/y95jzg/2700yearold_rock_carvings_discovered_in_iraq/,compound,-0.4404
45,Crystal meth pours into Iraq across porous borders with Iran,157,26,1666012782.0,https://www.reddit.com/r/worldnews/comments/y6b3yg/crystal_meth_pours_into_iraq_across_porous/,compound,0.0
46,Missiles target Khor Mor gas field in Iraq's Kurdistan -sources,25,5,1665594934.0,https://www.reddit.com/r/worldnews/comments/y29obt/missiles_target_khor_mor_gas_field_in_iraqs/,compound,0.0
47,"Iraq's parliament will meet Thursday to ""elect the president"", speaker Mohammed al-Halbussi's office said, in a surprise move seen at trying to end months of political impasse.",14,1,1665500366.0,https://www.reddit.com/r/worldnews/comments/y1b93g/iraqs_parliament_will_meet_thursday_to_elect_the/,compound,0.2732
48,"Turkey says it 'neutralised' 30 PKK members in Iraq, Syria",67,1,1664722407.0,https://www.reddit.com/r/worldnews/comments/xtqr32/turkey_says_it_neutralised_30_pkk_members_in_iraq/,compound,0.0
49,Iran Threatens Response If U.S. Targets Drones Used In Campaign Against Kurds In Iraq,115,25,1664616210.0,https://www.reddit.com/r/worldnews/comments/xsqvld/iran_threatens_response_if_us_targets_drones_used/,compound,-0.3818
