Title,Score,Number_Of_Comments,Publish_Date,Link,SentimentScore
"US pressures Middle East allies such as Egypt and the United Arab Emirates to expel Russia's Wagner mercenaries from Libya, Sudan",1641,33,1675435213.0,https://www.reddit.com/r/worldnews/comments/10slw87/us_pressures_middle_east_allies_such_as_egypt_and/,
Germany receives first hydrogen shipment from UAE | The first official delivery of hydrogen from the United Arab Emirates has arrived in Hamburg. Germany hopes the fuel will help replace coal and natural gas in energy-intensive industries.,556,114,1666392453.0,https://www.reddit.com/r/worldnews/comments/ya740t/germany_receives_first_hydrogen_shipment_from_uae/,
"United Arab Emirates clamps down on money laundering, potential terrorism financing",65,3,1659561991.0,https://www.reddit.com/r/worldnews/comments/wfikb4/united_arab_emirates_clamps_down_on_money/,
"Indian authorities reported on Monday Asia's first possible monkeypox fatality after the death of a man who recently returned from United Arab Emirates testing positive. Kerala state's health ministry said tests on the 22-year-old ""showed that the man had monkeypox""",81,5,1659375390.0,https://www.reddit.com/r/worldnews/comments/wdndky/indian_authorities_reported_on_monday_asias_first/,
United Arab Emirates sentences Khashoggi's former US lawyer to prison on money laundering charges,151,12,1658072676.0,https://www.reddit.com/r/worldnews/comments/w1ab2b/united_arab_emirates_sentences_khashoggis_former/,
Pride: Amazon restricts LGBT goods in United Arab Emirates.,73,31,1656566384.0,https://www.reddit.com/r/worldnews/comments/vo0e1n/pride_amazon_restricts_lgbt_goods_in_united_arab/,
"Israel, United Arab Emirates sign historic free trade deal, the first trade deal Israel signed with an Arab country. Custom duties to be abolished on 96% of products",75,2,1653992441.0,https://www.reddit.com/r/worldnews/comments/v1n21n/israel_united_arab_emirates_sign_historic_free/,
French authorities have opened a case against Interpol president Ahmed Nasser al-Raisi of the United Arab Emirates over accusations of torture and arbitrary detention filed by two Britons who were detained in the country,375,9,1652288311.0,https://www.reddit.com/r/worldnews/comments/uneh8s/french_authorities_have_opened_a_case_against/,
"Israel said Friday it would host the foreign ministers of the United Arab Emirates, Morocco and Bahrain during U.S. Secretary of State Antony Blinken's visit early next week, in what would be the latest in a flurry of high-level meetings held across the Middle East.",53,6,1648219185.0,https://www.reddit.com/r/worldnews/comments/tnnduk/israel_said_friday_it_would_host_the_foreign/,
"U.S. recalls cable saying India and UAE are “in Russia’s camp” | The State Department has recalled a cable to U.S. diplomats that instructed them to inform counterparts from India and the United Arab Emirates their position of neutrality on Ukraine put them ""in Russia's camp"".",98,71,1646304906.0,https://www.reddit.com/r/worldnews/comments/t5ozog/us_recalls_cable_saying_india_and_uae_are_in/,
"Iraq, Jordan, Kuwait, Saudi Arabia and the United Arab Emirates ask their citizens to leave Ukraine.",129,15,1644686170.0,https://www.reddit.com/r/worldnews/comments/sqwb26/iraq_jordan_kuwait_saudi_arabia_and_the_united/,
"A little-known militant group, Alwiyat al-Waad al-Haq (True Pledge Brigades) has claimed the latest drone attack on the United Arab Emirates, widening regional security risks. The new group is suspected to be tied to pro-Iranian militias in Iraq.",14,1,1643906783.0,https://www.reddit.com/r/worldnews/comments/sjnv9u/a_littleknown_militant_group_alwiyat_alwaad_alhaq/,
"The U.S. military launched interceptor missiles during an attack by Yemen's Houthi rebels that targeted the United Arab Emirates during a visit by Israel's president, the second-such time American troops have opened fire, officials said.",100,9,1643732029.0,https://www.reddit.com/r/worldnews/comments/shynn7/the_us_military_launched_interceptor_missiles/,
"The US military joined with the United Arab Emirates on Monday to counter a missile attack by Yemen's Houthis on an air base near its capital Abu Dhabi, where approximately 2,000 American service members and personnel are stationed",282,38,1643082548.0,https://www.reddit.com/r/worldnews/comments/sc4bla/the_us_military_joined_with_the_united_arab/,
U.S. Intervenes to Repel Air Attack on United Arab Emirates,83,16,1643041829.0,https://www.reddit.com/r/worldnews/comments/sbq3co/us_intervenes_to_repel_air_attack_on_united_arab/,
Eleven people were killed in coalition air strikes on Yemen's rebel-held capital Sanaa after the insurgents launched a rare and deadly attack on the United Arab Emirates,10,1,1642501047.0,https://www.reddit.com/r/worldnews/comments/s6ub3y/eleven_people_were_killed_in_coalition_air/,
Dubai: employees and schoolchildren juggled work and studies with weekly Muslim prayers on the first ever working Friday in the United Arab Emirates as the Gulf country formally switched to a Saturday-Sunday weekend.,31,4,1641596712.0,https://www.reddit.com/r/worldnews/comments/rykp3n/dubai_employees_and_schoolchildren_juggled_work/,
United Arab Emirates to end censorship of cinematic releases,70,7,1640073844.0,https://www.reddit.com/r/worldnews/comments/rl9r7h/united_arab_emirates_to_end_censorship_of/,
The United Arab Emirates' top national security adviser Sheikh Tahnoon bin Zayed Al Nahyan visits Iran on Monday to discuss expanding bilateral ties with the Islamic Republic.,39,1,1638784582.0,https://www.reddit.com/r/worldnews/comments/ra3rmn/the_united_arab_emirates_top_national_security/,
"An important meeting between the Minister of Foreign Affairs of the United Arab Emirates, the Minister of Foreign Affairs of the United States of America and the Minister of Foreign Affairs of the State of Israel.",5,5,1634206659.0,https://www.reddit.com/r/worldnews/comments/q7ws1r/an_important_meeting_between_the_minister_of/,
Three former US intelligence operatives have admitted to breaking US laws by carrying out hacking operations for the United Arab Emirates,1202,32,1631713798.0,https://www.reddit.com/r/worldnews/comments/poqi0d/three_former_us_intelligence_operatives_have/,
Three US former intelligence agents admitted in a Virginia court Tuesday to taking part in a United Arab Emirates hacking operation aimed at enemies and rivals of the Gulf country,72,7,1631665661.0,https://www.reddit.com/r/worldnews/comments/pof802/three_us_former_intelligence_agents_admitted_in_a/,
"Saudi Arabia threatens 3-year travel ban for citizens who visit ""red list"" states - The kingdom has banned travel to or transit at a number of countries including Argentina, Brazil, Egypt, Ethiopia, India, Lebanon, South Africa, Turkey, and the United Arab Emirates.",73,2,1627397841.0,https://www.reddit.com/r/worldnews/comments/osog1p/saudi_arabia_threatens_3year_travel_ban_for/,
Drones are zapping clouds with electricity to create rain in United Arab Emirates project,90,13,1627000648.0,https://www.reddit.com/r/worldnews/comments/opqywy/drones_are_zapping_clouds_with_electricity_to/,
Israel's Mansour Abbas (United Arab List) ready to join Bennett (Yamina) led government,19,9,1618833693.0,https://www.reddit.com/r/worldnews/comments/mtz2i0/israels_mansour_abbas_united_arab_list_ready_to/,
"India-Pakistan relation: Shah Mahmood Qureshi confirms mediation by United Arab Emirates, New Delhi mum",0,0,1618809642.0,https://www.reddit.com/r/worldnews/comments/mttrxg/indiapakistan_relation_shah_mahmood_qureshi/,
United Arab Emirates becomes the first Arab country to reach Mars,87,26,1612887831.0,https://www.reddit.com/r/worldnews/comments/lg6xpi/united_arab_emirates_becomes_the_first_arab/,
Israel Is Going To Market Its Weapons Systems In The United Arab Emirates,34,15,1612531937.0,https://www.reddit.com/r/worldnews/comments/ld76f5/israel_is_going_to_market_its_weapons_systems_in/,
"The United Arab Emirates is set to become the newest member of the European Bank for Reconstruction and Development, alarming rights activists who say the multilateral lender has strayed from its mandate to champion “multiparty democracy” and “pluralism”",36,2,1612281297.0,https://www.reddit.com/r/worldnews/comments/laytq6/the_united_arab_emirates_is_set_to_become_the/,
"Ahmed Mansoor, a prominent UAE human rights activist, has been held for four years in a tiny 2m x 2m solitary confinement cell with no bed or mattress in the United Arab Emirates, according to Human Rights Watch",9197,235,1611935126.0,https://www.reddit.com/r/worldnews/comments/l7vr13/ahmed_mansoor_a_prominent_uae_human_rights/,
"Spyware sold by an Israeli private intelligence firm was allegedly used to hack the phones of dozens of Al Jazeera journalists in an unprecedented cyber-attack that is likely to have been ordered by Saudi Arabia and the United Arab Emirates, according to leading researchers",5162,318,1608515128.0,https://www.reddit.com/r/worldnews/comments/kh7brr/spyware_sold_by_an_israeli_private_intelligence/,
United Arab Emirates Claims China’s Sinopharm Vaccine Is 100% Effective At Preventing Moderate And Severe Covid-19,28,12,1607534589.0,https://www.reddit.com/r/worldnews/comments/k9w3tf/united_arab_emirates_claims_chinas_sinopharm/,
US accuses UAE of funding Russian mercenaries in Libya - US Africa Command says Wagner Group's support of Khalifa Haftar may have been paid for by its ally the United Arab Emirates,12,4,1606925984.0,https://www.reddit.com/r/worldnews/comments/k5cavx/us_accuses_uae_of_funding_russian_mercenaries_in/,
UAE announces relaxing of Islamic laws for personal freedoms | United Arab Emirates,90,4,1604755398.0,https://www.reddit.com/r/worldnews/comments/jpqr6y/uae_announces_relaxing_of_islamic_laws_for/,
Sudan formally recognizes Israel in United States-brokered deal to become third Muslim country to recognize Israel after United Arab Emirates and Bahrain,61,20,1603476943.0,https://www.reddit.com/r/worldnews/comments/jgsk7a/sudan_formally_recognizes_israel_in_united/,
"Seven countries join NASA to explore the Moon peacefully, transparently | Signing the Artemis Accords alongside the United States were Australia, Canada, Japan, Luxembourg, Italy, the United Kingdom, and the United Arab Emirates",3094,302,1602624485.0,https://www.reddit.com/r/worldnews/comments/jamwcf/seven_countries_join_nasa_to_explore_the_moon/,
United Arab Emirates to launch spacecraft to moon in 2024,7,7,1601410309.0,https://www.reddit.com/r/worldnews/comments/j276e7/united_arab_emirates_to_launch_spacecraft_to_moon/,
United Arab Emirates to launch spacecraft to moon in 2024,13,3,1601372989.0,https://www.reddit.com/r/worldnews/comments/j1w8ju/united_arab_emirates_to_launch_spacecraft_to_moon/,
Israel signs accords with United Arab Emirates and Bahrain at White House ceremony,36,6,1600215184.0,https://www.reddit.com/r/worldnews/comments/itkv82/israel_signs_accords_with_united_arab_emirates/,
"Christian Tybring-Gjedde, a right-wing member of the Norwegian parliament, has nominated Donald Trump for the Nobel Peace Prize for his role in brokering a peace between Israel and the United Arab Emirates (UAE).",144,166,1599646138.0,https://www.reddit.com/r/worldnews/comments/ipd5xa/christian_tybringgjedde_a_rightwing_member_of_the/,
"Israel and the United Arab Emirates will sign their historic normalization deal at White House next week, U.S. officials say.",16,1,1599588890.0,https://www.reddit.com/r/worldnews/comments/ioyukh/israel_and_the_united_arab_emirates_will_sign/,
"Argentina joins Peru, Morocco and the United Arab Emirates in approving Phase 3 clinical trials for a coronavirus vaccine developed by China National Biotec Group (CNBG)",22,2,1598146756.0,https://www.reddit.com/r/worldnews/comments/ieusc0/argentina_joins_peru_morocco_and_the_united_arab/,
"The agreement between Israel and the United Arab Emirates to normalize ties would kill the two-state solution, strengthen ""extremists"" and undermine the ""possibility of peace"", chief Palestinian negotiator Saeb Erekat",4,15,1597601378.0,https://www.reddit.com/r/worldnews/comments/iax7kj/the_agreement_between_israel_and_the_united_arab/,
Telephone service between the United Arab Emirates and Israel begins as two countries open diplomatic ties,18,3,1597575942.0,https://www.reddit.com/r/worldnews/comments/iaqj63/telephone_service_between_the_united_arab/,
"In historic declaration, Israel and United Arab Emirates agree to normalize ties",21,1,1597337299.0,https://www.reddit.com/r/worldnews/comments/i93ggh/in_historic_declaration_israel_and_united_arab/,
Israel and UAE strike historic deal - Israel and the United Arab Emirates reach historic deal which will normalise relations between the countries,61,3,1597331243.0,https://www.reddit.com/r/worldnews/comments/i91k0a/israel_and_uae_strike_historic_deal_israel_and/,
"A major fire erupted at an Iranian market in Ajman, United Arab Emirates (U.A.E.), on Wednesday | Civil Defense rushed fire engines and police to the scene, where firefighters are currently still trying to put out the reportedly “raging” fire at press time.",2,2,1596652649.0,https://www.reddit.com/r/worldnews/comments/i4azg4/a_major_fire_erupted_at_an_iranian_market_in/,
United Arab Emirates launches 'Hope' mission to Mars on Japanese rocket,21,2,1595204609.0,https://www.reddit.com/r/worldnews/comments/hubdub/united_arab_emirates_launches_hope_mission_to/,
United Arab Emirates (UAE) launches historic first mission to Mars,2,3,1595197941.0,https://www.reddit.com/r/worldnews/comments/hu9mw6/united_arab_emirates_uae_launches_historic_first/,
"In a first, the United Arab Emirates is despatching a satellite to Mars to study its weather and climate.",17,7,1594700542.0,https://www.reddit.com/r/worldnews/comments/hquso1/in_a_first_the_united_arab_emirates_is/,
